{
  "version": "1.0",
  "assets": [
    {
      "id": "s01-title:visual",
      "type": "video",
      "scene_id": "s01-title",
      "source_tool": "modelslab",
      "source_block_ids": [
        "p0001-b0001"
      ],
      "strategy": "generated_3d_video",
      "provider": "modelslab",
      "status": "planned",
      "path": "",
      "qa_status": "pending"
    },
    {
      "id": "s02-objectives:visual",
      "type": "video",
      "scene_id": "s02-objectives",
      "source_tool": "modelslab",
      "source_block_ids": [
        "p0001-b0002",
        "p0001-b0003",
        "p0001-b0004",
        "p0001-b0005",
        "p0001-b0006",
        "p0001-b0007",
        "p0001-b0008",
        "p0001-b0009"
      ],
      "strategy": "generated_3d_video",
      "provider": "modelslab",
      "status": "planned",
      "path": "",
      "qa_status": "pending"
    },
    {
      "id": "s03-startup:visual",
      "type": "video",
      "scene_id": "s03-startup",
      "source_tool": "modelslab",
      "source_block_ids": [
        "p0001-b0010",
        "p0001-b0011"
      ],
      "strategy": "generated_3d_video",
      "provider": "modelslab",
      "status": "planned",
      "path": "",
      "qa_status": "pending"
    },
    {
      "id": "s04-spherical-earth:visual",
      "type": "video",
      "scene_id": "s04-spherical-earth",
      "source_tool": "modelslab",
      "source_block_ids": [
        "p0001-b0012",
        "p0001-b0013",
        "p0001-b0014"
      ],
      "strategy": "generated_3d_video",
      "provider": "modelslab",
      "status": "planned",
      "path": "",
      "qa_status": "pending"
    },
    {
      "id": "s05-two-movements:visual",
      "type": "video",
      "scene_id": "s05-two-movements",
      "source_tool": "modelslab",
      "source_block_ids": [
        "p0002-b0001",
        "p0002-b0002",
        "p0002-b0003",
        "p0002-b0004"
      ],
      "strategy": "generated_3d_video",
      "provider": "modelslab",
      "status": "planned",
      "path": "",
      "qa_status": "pending"
    },
    {
      "id": "s06-rotation:visual",
      "type": "video",
      "scene_id": "s06-rotation",
      "source_tool": "modelslab",
      "source_block_ids": [
        "p0002-b0005",
        "p0002-b0006",
        "p0002-b0007",
        "p0002-b0008"
      ],
      "strategy": "generated_3d_video",
      "provider": "modelslab",
      "status": "planned",
      "path": "",
      "qa_status": "pending"
    },
    {
      "id": "s07-do-you-know:visual",
      "type": "video",
      "scene_id": "s07-do-you-know",
      "source_tool": "modelslab",
      "source_block_ids": [
        "p0002-b0009",
        "p0002-b0010"
      ],
      "strategy": "generated_3d_video",
      "provider": "modelslab",
      "status": "planned",
      "path": "",
      "qa_status": "pending"
    },
    {
      "id": "s08-revolution:visual",
      "type": "video",
      "scene_id": "s08-revolution",
      "source_tool": "modelslab",
      "source_block_ids": [
        "p0002-b0011",
        "p0002-b0012",
        "p0002-b0013",
        "p0002-b0014",
        "p0002-b0015",
        "p0003-b0001",
        "p0003-b0002",
        "p0003-b0003"
      ],
      "strategy": "generated_3d_video",
      "provider": "modelslab",
      "status": "planned",
      "path": "",
      "qa_status": "pending"
    },
    {
      "id": "s09-day-length:visual",
      "type": "video",
      "scene_id": "s09-day-length",
      "source_tool": "modelslab",
      "source_block_ids": [
        "p0003-b0004",
        "p0003-b0005"
      ],
      "strategy": "generated_3d_video",
      "provider": "modelslab",
      "status": "planned",
      "path": "",
      "qa_status": "pending"
    },
    {
      "id": "s10-solstice:visual",
      "type": "video",
      "scene_id": "s10-solstice",
      "source_tool": "modelslab",
      "source_block_ids": [
        "p0003-b0006",
        "p0003-b0007"
      ],
      "strategy": "generated_3d_video",
      "provider": "modelslab",
      "status": "planned",
      "path": "",
      "qa_status": "pending"
    },
    {
      "id": "s11-inertia:visual",
      "type": "video",
      "scene_id": "s11-inertia",
      "source_tool": "modelslab",
      "source_block_ids": [
        "p0003-b0008",
        "p0003-b0009"
      ],
      "strategy": "generated_3d_video",
      "provider": "modelslab",
      "status": "planned",
      "path": "",
      "qa_status": "pending"
    },
    {
      "id": "s12-equinox:visual",
      "type": "video",
      "scene_id": "s12-equinox",
      "source_tool": "modelslab",
      "source_block_ids": [
        "p0003-b0010",
        "p0003-b0011",
        "p0003-b0012",
        "p0004-b0001"
      ],
      "strategy": "generated_3d_video",
      "provider": "modelslab",
      "status": "planned",
      "path": "",
      "qa_status": "pending"
    },
    {
      "id": "s13-recall:visual",
      "type": "animation",
      "scene_id": "s13-recall",
      "source_tool": "hyperframes",
      "source_block_ids": [
        "p0004-b0002",
        "p0004-b0003"
      ],
      "strategy": "stable_teaching_ui",
      "provider": "hyperframes",
      "status": "planned",
      "path": "",
      "qa_status": "not_applicable"
    },
    {
      "id": "s14-remember:visual",
      "type": "animation",
      "scene_id": "s14-remember",
      "source_tool": "hyperframes",
      "source_block_ids": [
        "p0004-b0004",
        "p0004-b0005",
        "p0004-b0006",
        "p0004-b0007",
        "p0004-b0008",
        "p0004-b0009"
      ],
      "strategy": "stable_teaching_ui",
      "provider": "hyperframes",
      "status": "planned",
      "path": "",
      "qa_status": "not_applicable"
    },
    {
      "id": "s15-wordbank:visual",
      "type": "animation",
      "scene_id": "s15-wordbank",
      "source_tool": "hyperframes",
      "source_block_ids": [
        "p0005-b0001",
        "p0005-b0002",
        "p0005-b0003",
        "p0005-b0004",
        "p0005-b0005",
        "p0005-b0006"
      ],
      "strategy": "stable_teaching_ui",
      "provider": "hyperframes",
      "status": "planned",
      "path": "",
      "qa_status": "not_applicable"
    }
  ],
  "total_cost_usd": 0.0,
  "metadata": {
    "project_id": "class-5-social-part-0-chapter-2-earth-movement",
    "fresh_assets_only": true
  }
}